{
  "$schema": "./framework_status.schema.json",
  "framework_version": "1.0.0",
  "last_updated": "2026-03-12T11:50:00.000Z",
  "current_phase": "development",
  "current_step": "swarm_tickets",
  "status": "pending",
  "mode": "full",
  "installation_type": "normal",
  "project_type": null,
  "project_name": null,
  "current_layer": "ticket",
  "current_ticket_id": null,
  "current_epic_id": null,
  "current_pi_id": null,
  "current_track": null,
  "phases": {
    "framework_bootstrap": {
      "status": "pending",
      "started_at": null,
      "completed_at": null,
      "steps": {
        "check_framework_setup": {
          "status": "pending",
          "started_at": null,
          "completed_at": null,
          "result": null,
          "error": null
        }
      }
    },
    "framework_installation": {
      "status": "pending",
      "started_at": null,
      "completed_at": null,
      "steps": {
        "framework_install": {
          "status": "pending",
          "started_at": null,
          "completed_at": null,
          "result": null,
          "error": null
        }
      }
    },
    "project_initialization": {
      "status": "pending",
      "started_at": null,
      "completed_at": null,
      "steps": {
        "detect_project_type": {
          "status": "pending",
          "started_at": null,
          "completed_at": null,
          "result": null,
          "error": null
        },
        "initialize_management_structure": {
          "status": "pending",
          "started_at": null,
          "completed_at": null,
          "result": null,
          "error": null
        }
      }
    },
    "product_definition": {
      "status": "pending",
      "started_at": null,
      "completed_at": null,
      "steps": {
        "vision_generation": {
          "status": "pending",
          "started_at": null,
          "completed_at": null,
          "result": null,
          "error": null
        },
        "vision_review": {
          "status": "pending",
          "started_at": null,
          "completed_at": null,
          "result": null,
          "error": null
        },
        "user_flow_creation": {
          "status": "pending",
          "started_at": null,
          "completed_at": null,
          "result": null,
          "error": null
        },
        "user_flow_review": {
          "status": "pending",
          "started_at": null,
          "completed_at": null,
          "result": null,
          "error": null
        },
        "user_flow_validation": {
          "status": "pending",
          "started_at": null,
          "completed_at": null,
          "result": null,
          "error": null
        },
        "requirements_alignment": {
          "status": "pending",
          "started_at": null,
          "completed_at": null,
          "result": null,
          "error": null
        },
        "generate_design_bible": {
          "status": "pending",
          "started_at": null,
          "completed_at": null,
          "result": null,
          "error": null
        },
        "approve_design_bible": {
          "status": "pending",
          "started_at": null,
          "completed_at": null,
          "result": null,
          "error": null
        },
        "requirements_review": {
          "status": "pending",
          "started_at": null,
          "completed_at": null,
          "result": null,
          "error": null
        },
        "ceo_product_audit": {
          "status": "pending",
          "started_at": null,
          "completed_at": null,
          "result": null,
          "error": null
        }
      }
    },
    "technical_architecture": {
      "status": "pending",
      "started_at": null,
      "completed_at": null,
      "steps": {
        "architecture_design": {
          "status": "pending",
          "started_at": null,
          "completed_at": null,
          "result": null,
          "error": null
        },
        "generate_tech_stack": {
          "status": "pending",
          "started_at": null,
          "completed_at": null,
          "result": null,
          "error": null
        },
        "generate_project_context": {
          "status": "pending",
          "started_at": null,
          "completed_at": null,
          "result": null,
          "error": null
        },
        "tech_stack_validation": {
          "status": "pending",
          "started_at": null,
          "completed_at": null,
          "result": null,
          "error": null
        },
        "database_schema_planning": {
          "status": "pending",
          "started_at": null,
          "completed_at": null,
          "result": null,
          "error": null
        },
        "api_contract_definition": {
          "status": "pending",
          "started_at": null,
          "completed_at": null,
          "result": null,
          "error": null
        },
        "eng_arch_audit": {
          "status": "pending",
          "started_at": null,
          "completed_at": null,
          "result": null,
          "error": null
        }
      }
    },
    "project_planning": {
      "status": "pending",
      "started_at": null,
      "completed_at": null,
      "steps": {
        "epic_generation": {
          "status": "pending",
          "started_at": null,
          "completed_at": null,
          "result": null,
          "error": null
        },
        "epic_review": {
          "status": "pending",
          "started_at": null,
          "completed_at": null,
          "result": null,
          "error": null
        },
        "ticket_generation": {
          "status": "pending",
          "started_at": null,
          "completed_at": null,
          "result": null,
          "error": null
        },
        "ticket_validation": {
          "status": "pending",
          "started_at": null,
          "completed_at": null,
          "result": null,
          "error": null
        },
        "project_timeline_generation": {
          "status": "pending",
          "started_at": null,
          "completed_at": null,
          "result": null,
          "error": null
        }
      }
    },
    "development": {
      "status": "pending",
      "started_at": null,
      "completed_at": null,
      "steps": {
        "swarm_tickets": {
          "status": "pending",
          "started_at": null,
          "completed_at": null,
          "result": null,
          "error": null
        },
        "ticket_selection": {
          "status": "pending",
          "started_at": null,
          "completed_at": null,
          "result": null,
          "error": null
        },
        "ticket_scoping": {
          "status": "pending",
          "started_at": null,
          "completed_at": null,
          "result": null,
          "error": null
        },
        "code_generation": {
          "status": "pending",
          "started_at": null,
          "completed_at": null,
          "result": null,
          "error": null
        },
        "interactive_ui_verification": {
          "status": "pending",
          "started_at": null,
          "completed_at": null,
          "result": null,
          "error": null
        },
        "code_review_ai": {
          "status": "pending",
          "started_at": null,
          "completed_at": null,
          "result": null,
          "error": null
        },
        "expert_code_review": {
          "status": "pending",
          "started_at": null,
          "completed_at": null,
          "result": null,
          "error": null
        },
        "unit_test_generation": {
          "status": "pending",
          "started_at": null,
          "completed_at": null,
          "result": null,
          "error": null
        },
        "unit_test_execution": {
          "status": "pending",
          "started_at": null,
          "completed_at": null,
          "result": null,
          "error": null
        },
        "visual_regression_qa": {
          "status": "pending",
          "started_at": null,
          "completed_at": null,
          "result": null,
          "error": null
        }
      }
    },
    "epic_hardening": {
      "status": "pending",
      "started_at": null,
      "completed_at": null,
      "steps": {
        "integration_testing": {
          "status": "pending",
          "started_at": null,
          "completed_at": null,
          "result": null,
          "error": null
        },
        "bug_fix_cycle": {
          "status": "pending",
          "started_at": null,
          "completed_at": null,
          "result": null,
          "error": null
        },
        "documentation_update": {
          "status": "pending",
          "started_at": null,
          "completed_at": null,
          "result": null,
          "error": null
        },
        "epic_validation": {
          "status": "pending",
          "started_at": null,
          "completed_at": null,
          "result": null,
          "error": null
        },
        "eng_epic_audit": {
          "status": "pending",
          "started_at": null,
          "completed_at": null,
          "result": null,
          "error": null
        },
        "ship_epic": {
          "status": "pending",
          "started_at": null,
          "completed_at": null,
          "result": null,
          "error": null
        },
        "knowledge_compression": {
          "status": "pending",
          "started_at": null,
          "completed_at": null,
          "result": null,
          "error": null
        },
        "epic_retrospective": {
          "status": "pending",
          "started_at": null,
          "completed_at": null,
          "result": null,
          "error": null
        }
      }
    },
    "pi_hardening": {
      "status": "pending",
      "started_at": null,
      "completed_at": null,
      "steps": {
        "system_testing": {
          "status": "pending",
          "started_at": null,